{"arguments_positions":[{"position":"Les difficultés scolaires ne justifient ni pillages ni agressions","horodatages":["00:01:01","00:04:01"]},{"position":"Le mouvement lycéen est instrumentalisé et ne constitue pas une révolution","horodatages":["00:09:03","00:13:01"]},{"position":"Le cadrage détourne l'attention des catégories productives","horodatages":["00:18:00","00:24:01"]}],"citations_exactes":[],"concepts":[{"nom":"instrumentalisation","horodatages":["00:09:03"]},{"nom":"structure de classe","horodatages":["00:13:01","00:18:00"]}],"evenements_lois_reglementations":[{"nom":"Gilets jaunes de 2018","niveau":"developpe","horodatages":["00:21:01"]}],"expressions_representatives":[{"expression":"révolte adolescente mise en scène","horodatages":["00:08:05","00:12:01"]}],"lieux_periodes":[{"nom":"France","niveau":"developpe","horodatages":["00:22:01"]}],"mots_cles":["lycéens","école publique","violences","pillages","syndicats","gauche","Gilets jaunes","producteurs"],"organismes":[{"nom":"L'Humanité","niveau":"mention","horodatages":["00:05:05"]},{"nom":"France Culture","niveau":"mention","horodatages":["00:22:01"]}],"personnes":[],"relations_documentaires":[{"source":"problèmes scolaires","relation":"sont utilisés pour légitimer selon l'autrice","cible":"mobilisation violente","horodatages":["00:03:01"]},{"source":"mouvement lycéen","relation":"occulte","cible":"revendications des producteurs","horodatages":["00:18:00"]}],"reperes_temporels":[{"debut":"00:00:00","fin":"00:07:00","titre":"École et contradictions des violences"},{"debut":"00:07:00","fin":"00:13:00","titre":"Mise en scène de la radicalité"},{"debut":"00:13:00","fin":"00:18:00","titre":"Pourquoi ce n'est pas une révolution"},{"debut":"00:18:00","fin":"00:24:00","titre":"Catégories productives absentes"},{"debut":"00:24:00","fin":"00:28:29","titre":"Critique politique et appel aux adultes"}],"resume_general":"Critique d'un mouvement lycéen jugé instrumentalisé, violent et socialement incapable de porter une révolution populaire.","schema_version":"1.1","sujets_secondaires":[{"sujet":"état matériel des lycées","horodatages":["00:01:01"]},{"sujet":"antifascisme","horodatages":["00:25:01"]}],"themes_principaux":[{"theme":"mouvement lycéen","horodatages":["00:00:00"]},{"theme":"structure sociale des mobilisations","horodatages":["00:13:01"]}],"variantes_lexicales":[{"canonique":"mouvement lycéen","variantes":["manifs de lycéens","mobilisation"]},{"canonique":"violences","variantes":["pillages","agressions","émeutes"]}],"video_id":"6z4pbY0EBoE"}
