{"arguments_positions":[{"position":"Les émeutes résultent d'impunité, d'échec sécuritaire et d'excuses politiques","horodatages":["00:00:00","00:02:01"]},{"position":"Une réponse pénale et migratoire très ferme est nécessaire","horodatages":["00:08:00","00:10:01"]},{"position":"Une présidentielle anticipée doit permettre un changement de direction","horodatages":["00:12:05"]}],"citations_exactes":[],"concepts":[{"nom":"culture de l'excuse","horodatages":["00:10:01"]},{"nom":"libération nationale","horodatages":["00:14:02"]}],"evenements_lois_reglementations":[{"nom":"17 octobre 2026","niveau":"developpe","horodatages":["00:00:00"]},{"nom":"élection présidentielle anticipée","niveau":"developpe","horodatages":["00:12:05"]}],"expressions_representatives":[{"expression":"restauration de l'ordre","horodatages":["00:08:00"]}],"lieux_periodes":[{"nom":"France","niveau":"developpe","horodatages":["00:00:00"]}],"mots_cles":["émeutes","impunité","police","gauche","expulsion","déchéance de nationalité","présidentielle"],"organismes":[{"nom":"police","niveau":"developpe","horodatages":["00:04:00"]}],"personnes":[],"relations_documentaires":[{"source":"sous-effectifs policiers","relation":"aggravent selon l'autrice","cible":"désordre public","horodatages":["00:04:00"]},{"source":"présidentielle anticipée","relation":"doit permettre","cible":"nouvelle orientation nationale","horodatages":["00:12:05"]}],"reperes_temporels":[{"debut":"00:00:00","fin":"00:04:00","titre":"Responsabilités sociales et politiques"},{"debut":"00:04:00","fin":"00:08:00","titre":"Échec sécuritaire et pouvoir"},{"debut":"00:08:00","fin":"00:12:00","titre":"Mesures pénales et migratoires"},{"debut":"00:12:00","fin":"00:15:14","titre":"Présidentielle et libération nationale"}],"resume_general":"Réaction politique au 17 octobre attribuant les violences à l'impunité et réclamant fermeté pénale, mesures migratoires et présidentielle anticipée.","schema_version":"1.1","sujets_secondaires":[{"sujet":"moyens policiers","horodatages":["00:04:00"]},{"sujet":"récupération électorale","horodatages":["00:11:04"]}],"themes_principaux":[{"theme":"ordre public","horodatages":["00:00:00"]},{"theme":"sortie de crise institutionnelle","horodatages":["00:12:05"]}],"variantes_lexicales":[{"canonique":"émeutiers","variantes":["délinquants","criminels"]}],"video_id":"2zXRH6raSSk"}
