{"arguments_positions":[{"position":"Les pillages sont inexcusables et distincts des Gilets jaunes","horodatages":["00:02:06","00:03:00"]},{"position":"Responsabilité conjointe des auteurs, de leurs soutiens et de l'État défaillant","horodatages":["00:12:02","00:14:01"]},{"position":"La sortie exige ordre républicain et refondation politique","horodatages":["00:16:00","00:18:02"]}],"citations_exactes":[],"concepts":[{"nom":"ordre républicain","horodatages":["00:16:00"]},{"nom":"responsabilité politique","horodatages":["00:12:02"]}],"evenements_lois_reglementations":[{"nom":"17 octobre 2026","niveau":"developpe","horodatages":["00:00:00"]},{"nom":"Gilets jaunes","niveau":"developpe","horodatages":["00:03:00","00:15:00"]}],"expressions_representatives":[{"expression":"coupables, complices et suites","horodatages":["00:12:02"]}],"lieux_periodes":[{"nom":"France","niveau":"developpe","horodatages":["00:08:02"]},{"nom":"Limoges","niveau":"mention","horodatages":["00:00:00"]}],"mots_cles":["17 octobre","pillages","émeutes","Gilets jaunes","ordre républicain","État","gauche","résistance"],"organismes":[{"nom":"État français","niveau":"developpe","horodatages":["00:14:01"]},{"nom":"police","niveau":"developpe","horodatages":["00:15:00"]}],"personnes":[],"relations_documentaires":[{"source":"répression des Gilets jaunes","relation":"est opposée à","cible":"impréparation du 17 octobre","horodatages":["00:15:00"]}],"reperes_temporels":[{"debut":"00:00:00","fin":"00:06:00","titre":"Condamnation des pillages"},{"debut":"00:06:00","fin":"00:12:00","titre":"Origines sociales et ressentiment"},{"debut":"00:12:00","fin":"00:16:00","titre":"Responsabilités"},{"debut":"00:16:00","fin":"00:22:05","titre":"Ordre et sortie politique"}],"resume_general":"Condamnation des violences du 17 octobre, attribution de responsabilités multiples et appel à conjuguer ordre républicain et refondation politique.","schema_version":"1.1","sujets_secondaires":[{"sujet":"racisme et appartenance nationale","horodatages":["00:10:00","00:11:03"]}],"themes_principaux":[{"theme":"responsabilités du 17 octobre","horodatages":["00:12:02"]},{"theme":"sortie de crise","horodatages":["00:18:02"]}],"variantes_lexicales":[{"canonique":"violences","variantes":["pillages","destructions","émeutes"]}],"video_id":"YxRtBFbAA6A"}
