{
  "arguments_positions": [
    {
      "position": "Le gouvernement ne pouvait ignorer une date annoncée depuis un mois",
      "horodatages": [
        "00:00:00"
      ]
    },
    {
      "position": "Le récit d'une mobilisation sans revendications est trop simplificateur",
      "horodatages": [
        "00:02:03"
      ]
    },
    {
      "position": "Les priorités de protection paraissent incohérentes",
      "horodatages": [
        "00:04:00",
        "00:08:00"
      ]
    }
  ],
  "citations_exactes": [],
  "concepts": [
    {
      "nom": "satire politique",
      "horodatages": [
        "00:00:00"
      ]
    },
    {
      "nom": "priorités sécuritaires",
      "horodatages": [
        "00:08:00"
      ]
    }
  ],
  "evenements_lois_reglementations": [
    {
      "nom": "17 octobre 2026",
      "niveau": "developpe",
      "horodatages": [
        "00:00:00"
      ]
    }
  ],
  "expressions_representatives": [
    {
      "expression": "chocolateries mieux protégées que le Louvre",
      "horodatages": [
        "00:08:00"
      ]
    }
  ],
  "lieux_periodes": [
    {
      "nom": "Louvre",
      "niveau": "mention",
      "horodatages": [
        "00:08:00"
      ]
    },
    {
      "nom": "France",
      "niveau": "developpe",
      "horodatages": [
        "00:00:00"
      ]
    }
  ],
  "mots_cles": [
    "17 octobre",
    "gouvernement",
    "anticipation",
    "chocolateries",
    "Louvre",
    "revendications",
    "humour politique"
  ],
  "organismes": [
    {
      "nom": "gouvernement français",
      "niveau": "developpe",
      "horodatages": [
        "00:00:00"
      ]
    }
  ],
  "personnes": [
    {
      "nom": "Emmanuel Macron",
      "niveau": "mention",
      "horodatages": [
        "00:04:00"
      ]
    }
  ],
  "relations_documentaires": [
    {
      "source": "date annoncée",
      "relation": "contraste avec",
      "cible": "surprise gouvernementale",
      "horodatages": [
        "00:00:00"
      ]
    }
  ],
  "reperes_temporels": [
    {
      "debut": "00:00:00",
      "fin": "00:03:00",
      "titre": "Incompréhension et revendications"
    },
    {
      "debut": "00:03:00",
      "fin": "00:06:00",
      "titre": "Responsabilités répétées"
    },
    {
      "debut": "00:06:00",
      "fin": "00:09:15",
      "titre": "Satire des priorités sécuritaires"
    }
  ],
  "resume_general": "Chronique satirique sur l'impréparation apparente de l'État et l'incohérence des protections lors du 17 octobre.",
  "schema_version": "1.1",
  "sujets_secondaires": [
    {
      "sujet": "référence au film Les Valseuses",
      "horodatages": [
        "00:06:03"
      ]
    }
  ],
  "themes_principaux": [
    {
      "theme": "gestion gouvernementale du 17 octobre",
      "horodatages": [
        "00:00:00"
      ]
    },
    {
      "theme": "cadrage des revendications",
      "horodatages": [
        "00:02:03"
      ]
    }
  ],
  "variantes_lexicales": [
    {
      "canonique": "17 octobre",
      "variantes": [
        "événements",
        "mobilisation"
      ]
    }
  ],
  "video_id": "dZxixxd5ME4"
}
