{"arguments_positions":[{"position":"La désindustrialisation réduit les cotisations et alimente dette et prélèvements","horodatages":["00:02:02","00:04:00"]},{"position":"Les aides et crédits sur le carburant ne sont que des palliatifs","horodatages":["00:08:03","00:12:06"]},{"position":"La solution passe par la souveraineté et la sortie d'instances supranationales","horodatages":["00:13:00"]}],"citations_exactes":[],"concepts":[{"nom":"souveraineté économique","horodatages":["00:06:03","00:13:00"]},{"nom":"base productive","horodatages":["00:02:02"]},{"nom":"palliatif temporaire","horodatages":["00:12:06"]}],"evenements_lois_reglementations":[],"expressions_representatives":[{"expression":"s'endetter pour aller travailler","horodatages":["00:08:03"]}],"lieux_periodes":[{"nom":"France","niveau":"developpe","horodatages":["00:00:00"]}],"mots_cles":["carburants","dette","taux d'intérêt","production","cotisations","taxes","normes","énergie","souveraineté"],"organismes":[{"nom":"instances supranationales","niveau":"developpe","horodatages":["00:13:00"]}],"personnes":[{"nom":"Xi Jinping","niveau":"mention","horodatages":["00:10:00"]}],"relations_documentaires":[{"source":"recul de la production","relation":"réduit","cible":"cotisations sociales","horodatages":["00:02:02"]},{"source":"aides temporaires","relation":"ne corrigent pas","cible":"dépendance énergétique","horodatages":["00:12:06"]}],"reperes_temporels":[{"debut":"00:00:00","fin":"00:05:00","titre":"Dette et destruction productive"},{"debut":"00:05:00","fin":"00:09:00","titre":"Souveraineté et prélèvements"},{"debut":"00:09:00","fin":"00:13:00","titre":"Normes et palliatifs"},{"debut":"00:13:00","fin":"00:17:17","titre":"Rupture supranationale proposée"}],"resume_general":"Analyse militante du prix des carburants comme symptôme de désindustrialisation, de dette et de perte de souveraineté économique.","schema_version":"1.1","sujets_secondaires":[{"sujet":"coût de financement de l'État","horodatages":["00:00:00"]},{"sujet":"démocratie libérale","horodatages":["00:11:00"]}],"themes_principaux":[{"theme":"prix des carburants","horodatages":["00:08:03"]},{"theme":"production et dette","horodatages":["00:00:00","00:04:00"]}],"variantes_lexicales":[{"canonique":"production","variantes":["producteurs","richesse"]},{"canonique":"supranational","variantes":["instances supranationales"]}],"video_id":"ZVpQIdmRT6Y"}
